<?xml version="1.0" encoding="UTF-8"?>
<!DOCTYPE HardwareInfo PUBLIC "-//Linkare/ReC/HardwareInfo//-" "http://rec.linkare.com/HardwareInfoSchema.dtd">
<HardwareInfo id="ELAB_HIDROSTAT_DSPIC_V1.0" familiarName="Hidrostat"
	name="Basic STAMP" version="BS2" manufacturer="Parallax" driverVersion="v2">
	<description>
        <![CDATA[ 
        Esta experiência serve para - não esquecer de alterar esta descrição
        <b>Penso que pode ter coisas maradas aqui como html</b>
        ]]>
	</description>

	<parameter name="protocolo" type="ContinuousValue" value="1">
		<selection-list>
			<value order="1">0</value>
			<value order="2">1</value>
			<value order="3">1</value>
		</selection-list>
	</parameter>

	<parameter name="profundidade_inicial" type="ContinuousValue" value="0">
		<selection-list>
			<value order="1">0</value>
			<value order="2">1930</value>
			<value order="3">1</value>
		</selection-list>
	</parameter>

	<parameter name="profundidade_final" type="ContinuousValue" value="1000">
		<selection-list>
			<value order="1">0</value>
			<value order="2">1930</value>
			<value order="3">1</value>
		</selection-list>
	</parameter>

	<parameter name="numero_de_pontos" type="ContinuousValue" value="20">
		<selection-list>
			<value order="1">2</value>
			<value order="2">200</value>
			<value order="3">1</value>
		</selection-list>
	</parameter>

	<frequency-scale label="Sampling Interval">
		<min-frequency>
			<Frequency type="SamplingIntervalType" multiplier="milli">2000</Frequency>
		</min-frequency>
		<max-frequency>
			<Frequency type="SamplingIntervalType" multiplier="milli">5000</Frequency>
		</max-frequency>
		<step-frequency>
			<Frequency type="SamplingIntervalType" multiplier="milli">1</Frequency>
		</step-frequency>
	</frequency-scale>
	<Frequency type="SamplingIntervalType" multiplier="milli">1</Frequency>

	<sampling-scale>
		<min-samples>2</min-samples>
		<max-samples>200</max-samples>
		<step-samples>1</step-samples>
	</sampling-scale>

	<ChannelInfo name="hidrostat$rec.exp.hidrostat.hardwareinfo.channel.0.name"
		independent="false" direction="CHANNEL_INPUT">
		<scale label="hidrostat$rec.exp.hidrostat.hardwareinfo.channel.0.label"
			physicsunitname="hidrostat$rec.exp.hidrostat.hardwareinfo.channel.0.physicsunitname"
			physicsunitsymbol="m" multiplier="milli" selected="true">
			<min><PhysicsVal type="float">0</PhysicsVal></min>
			<max><PhysicsVal type="float">1.9</PhysicsVal></max>
			<step><PhysicsVal type="float">0.001</PhysicsVal></step>
			<errordefault><PhysicsVal type="float">5</PhysicsVal></errordefault>
		</scale>
	</ChannelInfo>

	<ChannelInfo name="hidrostat$rec.exp.hidrostat.hardwareinfo.channel.1.name"
		independent="false" direction="CHANNEL_INPUT">
		<scale label="hidrostat$rec.exp.hidrostat.hardwareinfo.channel.1.label"
			physicsunitname="hidrostat$rec.exp.hidrostat.hardwareinfo.channel.1.physicsunitname"
			physicsunitsymbol="Pa" multiplier="kilo" selected="true">
			<min><PhysicsVal type="float">0</PhysicsVal></min>
			<max><PhysicsVal type="float">30</PhysicsVal></max>
			<step><PhysicsVal type="float">0.001</PhysicsVal></step>
			<errordefault><PhysicsVal type="float">0.01</PhysicsVal></errordefault>
		</scale>
	</ChannelInfo>

	<ChannelInfo name="hidrostat$rec.exp.hidrostat.hardwareinfo.channel.2.name"
		independent="false" direction="CHANNEL_INPUT">
		<scale label="hidrostat$rec.exp.hidrostat.hardwareinfo.channel.2.label"
			physicsunitname="hidrostat$rec.exp.hidrostat.hardwareinfo.channel.2.physicsunitname"
			physicsunitsymbol="Pa" multiplier="kilo" selected="true">
			<min><PhysicsVal type="float">0</PhysicsVal></min>
			<max><PhysicsVal type="float">30</PhysicsVal></max>
			<step><PhysicsVal type="float">0.001</PhysicsVal></step>
			<errordefault><PhysicsVal type="float">0.01</PhysicsVal></errordefault>
		</scale>
	</ChannelInfo>

	<ChannelInfo name="hidrostat$rec.exp.hidrostat.hardwareinfo.channel.3.name"
		independent="false" direction="CHANNEL_INPUT">
		<scale label="hidrostat$rec.exp.hidrostat.hardwareinfo.channel.3.label"
			physicsunitname="hidrostat$rec.exp.hidrostat.hardwareinfo.channel.3.physicsunitname"
			physicsunitsymbol="Pa" multiplier="kilo" selected="true">
			<min><PhysicsVal type="float">0</PhysicsVal></min>
			<max><PhysicsVal type="float">30</PhysicsVal></max>
			<step><PhysicsVal type="float">0.001</PhysicsVal></step>
			<errordefault><PhysicsVal type="float">0.01</PhysicsVal></errordefault>
		</scale>
	</ChannelInfo>

	<ChannelInfo name="hidrostat$rec.exp.hidrostat.hardwareinfo.channel.4.name"
		independent="false" direction="CHANNEL_INPUT">
		<scale label="hidrostat$rec.exp.hidrostat.hardwareinfo.channel.4.label"
			physicsunitname="hidrostat$rec.exp.hidrostat.hardwareinfo.channel.4.physicsunitname"
			physicsunitsymbol="Pa" multiplier="kilo" selected="true">
			<min><PhysicsVal type="float">0</PhysicsVal></min>
			<max><PhysicsVal type="float">30</PhysicsVal></max>
			<step><PhysicsVal type="float">0.001</PhysicsVal></step>
			<errordefault><PhysicsVal type="float">0.01</PhysicsVal></errordefault>
		</scale>
	</ChannelInfo>

</HardwareInfo>
